{
  "schemaVersion": "1.0.0",
  "seedRawGetOccurrences": 527,
  "seedUniqueGetOperations": 503,
  "openapiUniqueGetOperations": 766,
  "overlap": 493,
  "seedOnly": [
    "/organizations/{org}/settings/billing/ai_credit/usage",
    "/organizations/{org}/settings/billing/budgets",
    "/organizations/{org}/settings/billing/budgets/{budget_id}",
    "/organizations/{org}/settings/billing/premium_request/usage",
    "/organizations/{org}/settings/billing/usage",
    "/organizations/{org}/settings/billing/usage/summary",
    "/users/{username}/settings/billing/ai_credit/usage",
    "/users/{username}/settings/billing/premium_request/usage",
    "/users/{username}/settings/billing/usage",
    "/users/{username}/settings/billing/usage/summary"
  ],
  "openapiOnly": [
    "/",
    "/advisories",
    "/advisories/{ghsa_id}",
    "/agents/repos/{owner}/{repo}/tasks",
    "/agents/repos/{owner}/{repo}/tasks/{task_id}",
    "/agents/tasks",
    "/agents/tasks/{task_id}",
    "/app",
    "/app/hook/config",
    "/app/hook/deliveries",
    "/app/hook/deliveries/{delivery_id}",
    "/app/installation-requests",
    "/app/installations",
    "/app/installations/{installation_id}",
    "/apps/{app_slug}",
    "/assignments/{assignment_id}",
    "/assignments/{assignment_id}/accepted_assignments",
    "/assignments/{assignment_id}/grades",
    "/classrooms",
    "/classrooms/{classroom_id}",
    "/classrooms/{classroom_id}/assignments",
    "/codes_of_conduct",
    "/codes_of_conduct/{key}",
    "/emojis",
    "/enterprise-installation/{enterprise_or_org}/server-statistics",
    "/enterprises/{enterprise}/actions/cache/retention-limit",
    "/enterprises/{enterprise}/actions/cache/storage-limit",
    "/enterprises/{enterprise}/actions/cache/usage",
    "/enterprises/{enterprise}/actions/hosted-runners",
    "/enterprises/{enterprise}/actions/hosted-runners/images/custom",
    "/enterprises/{enterprise}/actions/hosted-runners/images/custom/{image_definition_id}",
    "/enterprises/{enterprise}/actions/hosted-runners/images/custom/{image_definition_id}/versions",
    "/enterprises/{enterprise}/actions/hosted-runners/images/custom/{image_definition_id}/versions/{version}",
    "/enterprises/{enterprise}/actions/hosted-runners/images/github-owned",
    "/enterprises/{enterprise}/actions/hosted-runners/images/partner",
    "/enterprises/{enterprise}/actions/hosted-runners/limits",
    "/enterprises/{enterprise}/actions/hosted-runners/machine-sizes",
    "/enterprises/{enterprise}/actions/hosted-runners/platforms",
    "/enterprises/{enterprise}/actions/hosted-runners/{hosted_runner_id}",
    "/enterprises/{enterprise}/actions/oidc/customization/properties/repo",
    "/enterprises/{enterprise}/actions/permissions",
    "/enterprises/{enterprise}/actions/permissions/artifact-and-log-retention",
    "/enterprises/{enterprise}/actions/permissions/fork-pr-contributor-approval",
    "/enterprises/{enterprise}/actions/permissions/fork-pr-workflows-private-repos",
    "/enterprises/{enterprise}/actions/permissions/organizations",
    "/enterprises/{enterprise}/actions/permissions/selected-actions",
    "/enterprises/{enterprise}/actions/permissions/self-hosted-runners",
    "/enterprises/{enterprise}/actions/permissions/workflow",
    "/enterprises/{enterprise}/actions/policies",
    "/enterprises/{enterprise}/actions/policies/{policy_id}",
    "/enterprises/{enterprise}/actions/runner-groups",
    "/enterprises/{enterprise}/actions/runner-groups/{runner_group_id}",
    "/enterprises/{enterprise}/actions/runner-groups/{runner_group_id}/organizations",
    "/enterprises/{enterprise}/actions/runner-groups/{runner_group_id}/runners",
    "/enterprises/{enterprise}/actions/runners",
    "/enterprises/{enterprise}/actions/runners/deprecations/{version}",
    "/enterprises/{enterprise}/actions/runners/downloads",
    "/enterprises/{enterprise}/actions/runners/{runner_id}",
    "/enterprises/{enterprise}/actions/runners/{runner_id}/labels",
    "/enterprises/{enterprise}/announcement",
    "/enterprises/{enterprise}/apps/installable_organizations",
    "/enterprises/{enterprise}/apps/installable_organizations/{org}/accessible_repositories",
    "/enterprises/{enterprise}/apps/organizations/{org}/installations",
    "/enterprises/{enterprise}/apps/organizations/{org}/installations/{installation_id}/repositories",
    "/enterprises/{enterprise}/audit-log",
    "/enterprises/{enterprise}/audit-log/stream-key",
    "/enterprises/{enterprise}/audit-log/streams",
    "/enterprises/{enterprise}/audit-log/streams/{stream_id}",
    "/enterprises/{enterprise}/bypass-requests/push-rules",
    "/enterprises/{enterprise}/bypass-requests/secret-scanning",
    "/enterprises/{enterprise}/code-scanning/alerts",
    "/enterprises/{enterprise}/code-security/configurations",
    "/enterprises/{enterprise}/code-security/configurations/defaults",
    "/enterprises/{enterprise}/code-security/configurations/{configuration_id}",
    "/enterprises/{enterprise}/code-security/configurations/{configuration_id}/repositories",
    "/enterprises/{enterprise}/code_security_and_analysis",
    "/enterprises/{enterprise}/consumed-licenses",
    "/enterprises/{enterprise}/copilot/billing/seats",
    "/enterprises/{enterprise}/copilot/content_exclusion",
    "/enterprises/{enterprise}/copilot/custom-agents",
    "/enterprises/{enterprise}/copilot/custom-agents/source",
    "/enterprises/{enterprise}/copilot/usage-records",
    "/enterprises/{enterprise}/credentials",
    "/enterprises/{enterprise}/credentials/exports/{export_id}",
    "/enterprises/{enterprise}/credentials/{inventory_id}",
    "/enterprises/{enterprise}/dependabot/alerts",
    "/enterprises/{enterprise}/dependabot/repository-access",
    "/enterprises/{enterprise}/dismissal-requests/secret-scanning",
    "/enterprises/{enterprise}/enterprise-roles",
    "/enterprises/{enterprise}/enterprise-roles/{role_id}",
    "/enterprises/{enterprise}/enterprise-roles/{role_id}/teams",
    "/enterprises/{enterprise}/enterprise-roles/{role_id}/users",
    "/enterprises/{enterprise}/innersource-vulnerabilities/sync/status/{job_id}",
    "/enterprises/{enterprise}/installation",
    "/enterprises/{enterprise}/license-sync-status",
    "/enterprises/{enterprise}/members/{username}/copilot",
    "/enterprises/{enterprise}/network-configurations",
    "/enterprises/{enterprise}/network-configurations/{network_configuration_id}",
    "/enterprises/{enterprise}/network-settings/{network_settings_id}",
    "/enterprises/{enterprise}/org-properties/schema",
    "/enterprises/{enterprise}/org-properties/schema/{custom_property_name}",
    "/enterprises/{enterprise}/org-properties/values",
    "/enterprises/{enterprise}/properties/schema",
    "/enterprises/{enterprise}/properties/schema/{custom_property_name}",
    "/enterprises/{enterprise}/rulesets/{ruleset_id}",
    "/enterprises/{enterprise}/rulesets/{ruleset_id}/history",
    "/enterprises/{enterprise}/rulesets/{ruleset_id}/history/{version_id}",
    "/enterprises/{enterprise}/secret-scanning/alerts",
    "/enterprises/{enterprise}/secret-scanning/custom-patterns",
    "/enterprises/{enterprise}/secret-scanning/pattern-configurations",
    "/enterprises/{enterprise}/settings/billing/advanced-security",
    "/enterprises/{enterprise}/settings/billing/ai_credit/usage",
    "/enterprises/{enterprise}/settings/billing/budgets",
    "/enterprises/{enterprise}/settings/billing/budgets/{budget_id}",
    "/enterprises/{enterprise}/settings/billing/budgets/{budget_id}/user-states",
    "/enterprises/{enterprise}/settings/billing/cost-centers",
    "/enterprises/{enterprise}/settings/billing/cost-centers/{cost_center_id}",
    "/enterprises/{enterprise}/settings/billing/premium_request/usage",
    "/enterprises/{enterprise}/settings/billing/reports",
    "/enterprises/{enterprise}/settings/billing/reports/{report_id}",
    "/enterprises/{enterprise}/settings/billing/usage",
    "/enterprises/{enterprise}/settings/billing/usage/summary",
    "/enterprises/{enterprise}/visual-studio-subscriptions",
    "/events",
    "/feeds",
    "/gists",
    "/gists/public",
    "/gists/starred",
    "/gists/{gist_id}",
    "/gists/{gist_id}/comments",
    "/gists/{gist_id}/comments/{comment_id}",
    "/gists/{gist_id}/commits",
    "/gists/{gist_id}/forks",
    "/gists/{gist_id}/star",
    "/gists/{gist_id}/{sha}",
    "/gitignore/templates",
    "/gitignore/templates/{name}",
    "/installation/repositories",
    "/issues",
    "/licenses",
    "/licenses/{license}",
    "/marketplace_listing/accounts/{account_id}",
    "/marketplace_listing/plans",
    "/marketplace_listing/plans/{plan_id}/accounts",
    "/marketplace_listing/stubbed/accounts/{account_id}",
    "/marketplace_listing/stubbed/plans",
    "/marketplace_listing/stubbed/plans/{plan_id}/accounts",
    "/meta",
    "/networks/{owner}/{repo}/events",
    "/notifications",
    "/notifications/threads/{thread_id}",
    "/notifications/threads/{thread_id}/subscription",
    "/octocat",
    "/organizations",
    "/organizations/{organization_id}/custom_roles",
    "/organizations/{org}/org-properties/values",
    "/orgs/{org}",
    "/orgs/{org}/announcement",
    "/orgs/{org}/attestations/{subject_digest}",
    "/orgs/{org}/audit-log",
    "/orgs/{org}/bypass-requests/push-rules",
    "/orgs/{org}/bypass-requests/secret-scanning",
    "/orgs/{org}/credential-authorizations",
    "/orgs/{org}/custom-repository-roles",
    "/orgs/{org}/custom-repository-roles/{role_id}",
    "/orgs/{org}/custom_roles/{role_id}",
    "/orgs/{org}/dismissal-requests/code-scanning",
    "/orgs/{org}/dismissal-requests/dependabot",
    "/orgs/{org}/dismissal-requests/secret-scanning",
    "/orgs/{org}/docker/conflicts",
    "/orgs/{org}/events",
    "/orgs/{org}/external-group/{group_id}",
    "/orgs/{org}/external-groups",
    "/orgs/{org}/fine_grained_permissions",
    "/orgs/{org}/installation",
    "/orgs/{org}/issues",
    "/orgs/{org}/migrations",